### ISSUE TITLE
optimizations needed in multithreaded environment (far above 1 open/close per second otherwise)

### ISSUE THREAD

**Issue by aio-witc** [Nitrokey/nethsm-pkcs11#157]
When using the PKCS#11 module in a multithreaded environment, the module keeps opening and closing TCP sessions. This is undesirable (incurring several RTTs and useless TLS handshakes).

Context:
This behavior reduced the rate (signs/sec) to below 100 signatures/sec in one critical application (possible due to handshakes and network latency)

```
Key ID          Type    Mechanisms      Operations      Tags       
------------    ------- --------------- ----------      -----------
witcLoadTest    EC_P256 ECDSA_Signature 2608143         witcTesting
```

SINGLE-threaded (a single connection is opened and used)
```
tcpdump -n host zg-pxx-hsmlab.zg.ch | grep '\[[S|F]'
dropped privs to tcpdump
tcpdump: verbose output suppressed, use -v[v]... for full protocol decode
listening on eno1, link-type EN10MB (Ethernet), snapshot length 262144 bytes
20:15:29.929289 IP 10.8.97.141.52766 > 10.8.201.83.https: Flags [S], seq 1563232645, win 64240, options [mss 1460,sackOK,TS val 2938260778 ecr 0,nop,wscale 7], length 0
20:15:29.931645 IP 10.8.201.83.https > 10.8.97.141.52766: Flags [S.], seq 102215849, ack 1563232646, win 65535, options [mss 1460,wscale 2,eol], length 0
```

Multithreaded (>1 open/close per second):
```
20:33:49.005905 IP 10.8.97.141.48272 > 10.8.201.83.https: Flags [F.], seq 2185, ack 7646, win 501, length 0
20:33:49.008225 IP 10.8.97.141.48278 > 10.8.201.83.https: Flags [S], seq 2029303046, win 64240, options [mss 1460,sackOK,TS val 2939359857 ecr 0,nop,wscale 7], length 0
20:33:49.009669 IP 10.8.201.83.https > 10.8.97.141.48278: Flags [S.], seq 2639635798, ack 2029303047, win 65535, options [mss 1460,wscale 2,eol], length 0
20:33:49.027858 IP 10.8.97.141.48210 > 10.8.201.83.https: Flags [F.], seq 20885, ack 24246, win 501, length 0
20:33:49.031143 IP 10.8.97.141.48288 > 10.8.201.83.https: Flags [S], seq 53769796, win 64240, options [mss 1460,sackOK,TS val 2939359880 ecr 0,nop,wscale 7], length 0
20:33:49.033670 IP 10.8.201.83.https > 10.8.97.141.48288: Flags [S.], seq 2110510906, ack 53769797, win 65535, options [mss 1460,wscale 2,eol], length 0
20:33:49.139844 IP 10.8.97.141.48278 > 10.8.201.83.https: Flags [F.], seq 10039, ack 14618, win 501, length 0
20:33:49.141793 IP 10.8.97.141.48292 > 10.8.201.83.https: Flags [S], seq 957245259, win 64240, options [mss 1460,sackOK,TS val 2939359991 ecr 0,nop,wscale 7], length 0
20:33:49.143673 IP 10.8.201.83.https > 10.8.97.141.48292: Flags [S.], seq 268812798, ack 957245260, win 65535, options [mss 1460,wscale 2,eol], length 0
20:33:49.161868 IP 10.8.97.141.48242 > 10.8.201.83.https: Flags [F.], seq 27991, ack 30554, win 501, length 0
20:33:49.164202 IP 10.8.97.141.48308 > 10.8.201.83.https: Flags [S], seq 3308644755, win 64240, options [mss 1460,sackOK,TS val 2939360013 ecr 0,nop,wscale 7], length 0
20:33:49.165673 IP 10.8.201.83.https > 10.8.97.141.48308: Flags [S.], seq 3165752162, ack 3308644756, win 65535, options [mss 1460,wscale 2,eol], length 0
20:33:49.213849 IP 10.8.97.141.48226 > 10.8.201.83.https: Flags [F.], seq 34723, ack 36530, win 501, length 0
20:33:49.214098 IP 10.8.97.141.48288 > 10.8.201.83.https: Flags [F.], seq 13405, ack 17606, win 501, length 0
20:33:49.215577 IP 10.8.97.141.48324 > 10.8.201.83.https: Flags [S], seq 3271855260, win 64240, options [mss 1460,sackOK,TS val 2939360064 ecr 0,nop,wscale 7], length 0
20:33:49.217153 IP 10.8.97.141.48338 > 10.8.201.83.https: Flags [S], seq 4219198814, win 64240, options [mss 1460,sackOK,TS val 2939360066 ecr 0,nop,wscale 7], length 0
20:33:49.217520 IP 10.8.201.83.https > 10.8.97.141.48338: Flags [S.], seq 2071017705, ack 4219198815, win 65535, options [mss 1460,wscale 2,eol], length 0
20:33:49.217520 IP 10.8.201.83.https > 10.8.97.141.48324: Flags [S.], seq 1400830969, ack 3271855261, win 65535, options [mss 1460,wscale 2,eol], length 0
20:33:49.241837 IP 10.8.97.141.48338 > 10.8.201.83.https: Flags [F.], seq 1437, ack 6982, win 501, length 0
20:33:49.243598 IP 10.8.97.141.48350 > 10.8.201.83.https: Flags [S], seq 1188284553, win 64240, options [mss 1460,sackOK,TS val 2939360093 ecr 0,nop,wscale 7], length 0
20:33:49.245678 IP 10.8.201.83.https > 10.8.97.141.48350: Flags [S.], seq 109645755, ack 1188284554, win 65535, options [mss 1460,wscale 2,eol], length 0
20:33:49.267870 IP 10.8.97.141.48324 > 10.8.201.83.https: Flags [F.], seq 3681, ack 8974, win 501, length 0
20:33:49.270044 IP 10.8.97.141.48362 > 10.8.201.83.https: Flags [S], seq 1768176957, win 64240, options [mss 1460,sackOK,TS val 2939360119 ecr 0,nop,wscale 7], length 0
20:33:49.273713 IP 10.8.201.83.https > 10.8.97.141.48362: Flags [S.], seq 1934353512, ack 1768176958, win 65535, options [mss 1460,wscale 2,eol], length 0
20:33:49.351891 IP 10.8.97.141.48362 > 10.8.201.83.https: Flags [F.], seq 5925, ack 10966, win 501, length 0
20:33:49.353885 IP 10.8.97.141.48372 > 10.8.201.83.https: Flags [S], seq 3052956111, win 64240, options [mss 1460,sackOK,TS val 2939360203 ecr 0,nop,wscale 7], length 0
20:33:49.357617 IP 10.8.201.83.https > 10.8.97.141.48372: Flags [S.], seq 6500967, ack 3052956112, win 65535, options [mss 1460,wscale 2,eol], length 0
20:33:49.371884 IP 10.8.97.141.48292 > 10.8.201.83.https: Flags [F.], seq 16023, ack 19930, win 501, length 0
20:33:49.372144 IP 10.8.97.141.48308 > 10.8.201.83.https: Flags [F.], seq 14901, ack 18934, win 501, length 0
20:33:49.373804 IP 10.8.97.141.48384 > 10.8.201.83.https: Flags [S], seq 3984470684, win 64240, options [mss 1460,sackOK,TS val 2939360223 ecr 0,nop,wscale 7], length 0
20:33:49.374202 IP 10.8.97.141.48390 > 10.8.201.83.https: Flags [S], seq 713243019, win 64240, options [mss 1460,sackOK,TS val 2939360223 ecr 0,nop,wscale 7], length 0
20:33:49.375670 IP 10.8.201.83.https > 10.8.97.141.48384: Flags [S.], seq 1264401306, ack 3984470685, win 65535, options [mss 1460,wscale 2,eol], length 0
20:33:49.375670 IP 10.8.201.83.https > 10.8.97.141.48390: Flags [S.], seq 3214012313, ack 713243020, win 65535, options [mss 1460,wscale 2,eol], length 0
20:33:49.393884 IP 10.8.97.141.48372 > 10.8.201.83.https: Flags [F.], seq 2185, ack 7646, win 501, length 0
20:33:49.394147 IP 10.8.97.141.48350 > 10.8.201.83.https: Flags [F.], seq 11161, ack 15614, win 501, length 0
20:33:49.395943 IP 10.8.97.141.48400 > 10.8.201.83.https: Flags [S], seq 820876633, win 64240, options [mss 1460,sackOK,TS val 2939360245 ecr 0,nop,wscale 7], length 0
20:33:49.396285 IP 10.8.97.141.48414 > 10.8.201.83.https: Flags [S], seq 3363450127, win 64240, options [mss 1460,sackOK,TS val 2939360245 ecr 0,nop,wscale 7], length 0
20:33:49.397671 IP 10.8.201.83.https > 10.8.97.141.48414: Flags [S.], seq 60786841, ack 3363450128, win 65535, options [mss 1460,wscale 2,eol], length 0
20:33:49.397671 IP 10.8.201.83.https > 10.8.97.141.48400: Flags [S.], seq 549055792, ack 820876634, win 65535, options [mss 1460,wscale 2,eol], length 0
20:33:49.429854 IP 10.8.97.141.48400 > 10.8.201.83.https: Flags [F.], seq 1811, ack 7314, win 501, length 0
20:33:49.432072 IP 10.8.97.141.48424 > 10.8.201.83.https: Flags [S], seq 2805278051, win 64240, options [mss 1460,sackOK,TS val 2939360281 ecr 0,nop,wscale 7], length 0
20:33:49.433667 IP 10.8.201.83.https > 10.8.97.141.48424: Flags [S.], seq 2724521132, ack 2805278052, win 65535, options [mss 1460,wscale 2,eol], length 0
20:33:49.457886 IP 10.8.97.141.48390 > 10.8.201.83.https: Flags [F.], seq 5925, ack 10966, win 501, length 0
20:33:49.459940 IP 10.8.97.141.48434 > 10.8.201.83.https: Flags [S], seq 1772661389, win 64240, options [mss 1460,sackOK,TS val 2939360309 ecr 0,nop,wscale 7], length 0
20:33:49.463684 IP 10.8.201.83.https > 10.8.97.141.48434: Flags [S.], seq 3454194084, ack 1772661390, win 65535, options [mss 1460,wscale 2,eol], length 0
20:33:49.505857 IP 10.8.97.141.48384 > 10.8.201.83.https: Flags [F.], seq 9665, ack 14286, win 501, length 0
20:33:49.508251 IP 10.8.97.141.48442 > 10.8.201.83.https: Flags [S], seq 4257835924, win 64240, options [mss 1460,sackOK,TS val 2939360357 ecr 0,nop,wscale 7], length 0
20:33:49.511716 IP 10.8.201.83.https > 10.8.97.141.48442: Flags [S.], seq 2421414974, ack 4257835925, win 65535, options [mss 1460,wscale 2,eol], length 0
20:33:49.529804 IP 10.8.97.141.48424 > 10.8.201.83.https: Flags [F.], seq 6299, ack 11298, win 501, length 0
20:33:49.531393 IP 10.8.97.141.48446 > 10.8.201.83.https: Flags [S], seq 3056374917, win 64240, options [mss 1460,sackOK,TS val 2939360380 ecr 0,nop,wscale 7], length 0
20:33:49.533666 IP 10.8.201.83.https > 10.8.97.141.48446: Flags [S.], seq 902513097, ack 3056374918, win 65535, options [mss 1460,wscale 2,eol], length 0
20:33:49.563858 IP 10.8.97.141.48434 > 10.8.201.83.https: Flags [F.], seq 7795, ack 12626, win 501, length 0
20:33:49.566078 IP 10.8.97.141.48452 > 10.8.201.83.https: Flags [S], seq 470057971, win 64240, options [mss 1460,sackOK,TS val 2939360415 ecr 0,nop,wscale 7], length 0
20:33:49.569712 IP 10.8.201.83.https > 10.8.97.141.48452: Flags [S.], seq 3802295947, ack 470057972, win 65535, options [mss 1460,wscale 2,eol], length 0
20:33:49.587853 IP 10.8.97.141.48414 > 10.8.201.83.https: Flags [F.], seq 14153, ack 18270, win 501, length 0
20:33:49.589557 IP 10.8.97.141.48460 > 10.8.201.83.https: Flags [S], seq 3798844209, win 64240, options [mss 1460,sackOK,TS val 2939360438 ecr 0,nop,wscale 7], length 0
20:33:49.593477 IP 10.8.201.83.https > 10.8.97.141.48460: Flags [S.], seq 4048808166, ack 3798844210, win 65535, options [mss 1460,wscale 2,eol], length 0
20:33:49.609799 IP 10.8.97.141.48460 > 10.8.201.83.https: Flags [F.], seq 689, ack 6318, win 501, length 0
20:33:49.610078 IP 10.8.97.141.48452 > 10.8.201.83.https: Flags [F.], seq 2933, ack 8310, win 501, length 0
20:33:49.611636 IP 10.8.97.141.48468 > 10.8.201.83.https: Flags [S], seq 3170233030, win 64240, options [mss 1460,sackOK,TS val 2939360461 ecr 0,nop,wscale 7], length 0
20:33:49.612050 IP 10.8.97.141.48474 > 10.8.201.83.https: Flags [S], seq 19673107, win 64240, options [mss 1460,sackOK,TS val 2939360461 ecr 0,nop,wscale 7], length 0
20:33:49.616744 IP 10.8.97.141.48474 > 10.8.201.83.https: Flags [S], seq 19673107, win 64240, options [mss 1460,sackOK,TS val 2939360466 ecr 0,nop,wscale 7], length 0
20:33:49.616796 IP 10.8.97.141.48468 > 10.8.201.83.https: Flags [S], seq 3170233030, win 64240, options [mss 1460,sackOK,TS val 2939360466 ecr 0,nop,wscale 7], length 0
20:33:49.619679 IP 10.8.201.83.https > 10.8.97.141.48474: Flags [S.], seq 4042154163, ack 19673108, win 65535, options [mss 1460,wscale 2,eol], length 0
20:33:49.619679 IP 10.8.201.83.https > 10.8.97.141.48468: Flags [S.], seq 1932934920, ack 3170233031, win 65535, options [mss 1460,wscale 2,eol], length 0
20:33:49.645787 IP 10.8.97.141.48474 > 10.8.201.83.https: Flags [F.], seq 1437, ack 6982, win 501, length 0
20:33:49.647928 IP 10.8.97.141.48482 > 10.8.201.83.https: Flags [S], seq 2708134453, win 64240, options [mss 1460,sackOK,TS val 2939360497 ecr 0,nop,wscale 7], length 0
20:33:49.649673 IP 10.8.201.83.https > 10.8.97.141.48482: Flags [S.], seq 1222567602, ack 2708134454, win 65535, options [mss 1460,wscale 2,eol], length 0
20:33:49.667809 IP 10.8.97.141.48446 > 10.8.201.83.https: Flags [F.], seq 10787, ack 15282, win 501, length 0
20:33:49.669450 IP 10.8.97.141.48492 > 10.8.201.83.https: Flags [S], seq 4196789371, win 64240, options [mss 1460,sackOK,TS val 2939360518 ecr 0,nop,wscale 7], length 0
20:33:49.671671 IP 10.8.201.83.https > 10.8.97.141.48492: Flags [S.], seq 3054377135, ack 4196789372, win 65535, options [mss 1460,wscale 2,eol], length 0
20:33:49.745801 IP 10.8.97.141.48492 > 10.8.201.83.https: Flags [F.], seq 5177, ack 10302, win 501, length 0
20:33:49.746062 IP 10.8.97.141.48482 > 10.8.201.83.https: Flags [F.], seq 6299, ack 11298, win 501, length 0
20:33:49.747458 IP 10.8.97.141.48494 > 10.8.201.83.https: Flags [S], seq 2036179105, win 64240, options [mss 1460,sackOK,TS val 2939360596 ecr 0,nop,wscale 7], length 0
20:33:49.747907 IP 10.8.97.141.48502 > 10.8.201.83.https: Flags [S], seq 4103582238, win 64240, options [mss 1460,sackOK,TS val 2939360597 ecr 0,nop,wscale 7], length 0
20:33:49.749693 IP 10.8.201.83.https > 10.8.97.141.48502: Flags [S.], seq 2735223383, ack 4103582239, win 65535, options [mss 1460,wscale 2,eol], length 0
20:33:49.749693 IP 10.8.201.83.https > 10.8.97.141.48494: Flags [S.], seq 202809858, ack 2036179106, win 65535, options [mss 1460,wscale 2,eol], length 0
20:33:49.827864 IP 10.8.97.141.48442 > 10.8.201.83.https: Flags [F.], seq 24625, ack 27558, win 501, length 0
20:33:49.830403 IP 10.8.97.141.48512 > 10.8.201.83.https: Flags [S], seq 133608865, win 64240, options [mss 1460,sackOK,TS val 2939360679 ecr 0,nop,wscale 7], length 0
20:33:49.836695 IP 10.8.97.141.48512 > 10.8.201.83.https: Flags [S], seq 133608865, win 64240, options [mss 1460,sackOK,TS val 2939360686 ecr 0,nop,wscale 7], length 0
20:33:49.837488 IP 10.8.201.83.https > 10.8.97.141.48512: Flags [S.], seq 1430140620, ack 133608866, win 65535, options [mss 1460,wscale 2,eol], length 0
20:33:49.853893 IP 10.8.97.141.48494 > 10.8.201.83.https: Flags [F.], seq 8169, ack 12958, win 501, length 0
20:33:49.855781 IP 10.8.97.141.48522 > 10.8.201.83.https: Flags [S], seq 890622381, win 64240, options [mss 1460,sackOK,TS val 2939360705 ecr 0,nop,wscale 7], length 0
20:33:49.857486 IP 10.8.201.83.https > 10.8.97.141.48522: Flags [S.], seq 3460911622, ack 890622382, win 65535, options [mss 1460,wscale 2,eol], length 0
20:33:49.873794 IP 10.8.97.141.48522 > 10.8.201.83.https: Flags [F.], seq 689, ack 6318, win 501, length 0
20:33:49.876299 IP 10.8.97.141.48538 > 10.8.201.83.https: Flags [S], seq 1966198314, win 64240, options [mss 1460,sackOK,TS val 2939360725 ecr 0,nop,wscale 7], length 0
20:33:49.877664 IP 10.8.201.83.https > 10.8.97.141.48538: Flags [S.], seq 3161610379, ack 1966198315, win 65535, options [mss 1460,wscale 2,eol], length 0
20:33:49.933874 IP 10.8.97.141.48512 > 10.8.201.83.https: Flags [F.], seq 7421, ack 12294, win 501, length 0
20:33:49.935604 IP 10.8.97.141.48548 > 10.8.201.83.https: Flags [S], seq 2720435918, win 64240, options [mss 1460,sackOK,TS val 2939360785 ecr 0,nop,wscale 7], length 0
20:33:49.939672 IP 10.8.201.83.https > 10.8.97.141.48548: Flags [S.], seq 3952928352, ack 2720435919, win 65535, options [mss 1460,wscale 2,eol], length 0
20:33:49.965819 IP 10.8.97.141.48502 > 10.8.201.83.https: Flags [F.], seq 16023, ack 19930, win 501, length 0
20:33:49.968352 IP 10.8.97.141.48558 > 10.8.201.83.https: Flags [S], seq 470473231, win 64240, options [mss 1460,sackOK,TS val 2939360817 ecr 0,nop,wscale 7], length 0
20:33:49.969666 IP 10.8.201.83.https > 10.8.97.141.48558: Flags [S.], seq 1203427897, ack 470473232, win 65535, options [mss 1460,wscale 2,eol], length 0
20:33:49.983875 IP 10.8.97.141.48538 > 10.8.201.83.https: Flags [F.], seq 7795, ack 12626, win 501, length 0
20:33:49.986216 IP 10.8.97.141.48568 > 10.8.201.83.https: Flags [S], seq 3180291095, win 64240, options [mss 1460,sackOK,TS val 2939360835 ecr 0,nop,wscale 7], length 0
20:33:49.987723 IP 10.8.201.83.https > 10.8.97.141.48568: Flags [S.], seq 486677336, ack 3180291096, win 65535, options [mss 1460,wscale 2,eol], length 0
20:33:50.001807 IP 10.8.97.141.48558 > 10.8.201.83.https: Flags [F.], seq 2185, ack 7646, win 501, length 0
20:33:50.004142 IP 10.8.97.141.48584 > 10.8.201.83.https: Flags [S], seq 743749183, win 64240, options [mss 1460,sackOK,TS val 2939360853 ecr 0,nop,wscale 7], length 0
20:33:50.005676 IP 10.8.201.83.https > 10.8.97.141.48584: Flags [S.], seq 1996775844, ack 743749184, win 65535, options [mss 1460,wscale 2,eol], length 0
20:33:50.023801 IP 10.8.97.141.48568 > 10.8.201.83.https: Flags [F.], seq 2185, ack 7646, win 501, length 0
20:33:50.026186 IP 10.8.97.141.48596 > 10.8.201.83.https: Flags [S], seq 1537649820, win 64240, options [mss 1460,sackOK,TS val 2939360875 ecr 0,nop,wscale 7], length 0
20:33:50.027668 IP 10.8.201.83.https > 10.8.97.141.48596: Flags [S.], seq 2208099349, ack 1537649821, win 65535, options [mss 1460,wscale 2,eol], length 0
20:33:50.049894 IP 10.8.97.141.48584 > 10.8.201.83.https: Flags [F.], seq 2933, ack 8310, win 501, length 0
20:33:50.050163 IP 10.8.97.141.48596 > 10.8.201.83.https: Flags [F.], seq 1063, ack 6650, win 501, length 0
20:33:50.051917 IP 10.8.97.141.48598 > 10.8.201.83.https: Flags [S], seq 2706082336, win 64240, options [mss 1460,sackOK,TS val 2939360901 ecr 0,nop,wscale 7], length 0
20:33:50.052473 IP 10.8.97.141.48608 > 10.8.201.83.https: Flags [S], seq 2259128080, win 64240, options [mss 1460,sackOK,TS val 2939360901 ecr 0,nop,wscale 7], length 0
20:33:50.053690 IP 10.8.201.83.https > 10.8.97.141.48598: Flags [S.], seq 3584179795, ack 2706082337, win 65535, options [mss 1460,wscale 2,eol], length 0
20:33:50.053690 IP 10.8.201.83.https > 10.8.97.141.48608: Flags [S.], seq 3873646541, ack 2259128081, win 65535, options [mss 1460,wscale 2,eol], length 0
20:33:50.089920 IP 10.8.97.141.48548 > 10.8.201.83.https: Flags [F.], seq 10787, ack 15282, win 501, length 0
20:33:50.092377 IP 10.8.97.141.48610 > 10.8.201.83.https: Flags [S], seq 1621046702, win 64240, options [mss 1460,sackOK,TS val 2939360941 ecr 0,nop,wscale 7], length 0
20:33:50.095711 IP 10.8.201.83.https > 10.8.97.141.48610: Flags [S.], seq 2003140879, ack 1621046703, win 65535, options [mss 1460,wscale 2,eol], length 0
20:33:50.117863 IP 10.8.97.141.48598 > 10.8.201.83.https: Flags [F.], seq 5177, ack 10302, win 501, length 0
20:33:50.119665 IP 10.8.97.141.48622 > 10.8.201.83.https: Flags [S], seq 3344315529, win 64240, options [mss 1460,sackOK,TS val 2939360969 ecr 0,nop,wscale 7], length 0
20:33:50.123679 IP 10.8.201.83.https > 10.8.97.141.48622: Flags [S.], seq 1439105751, ack 3344315530, win 65535, options [mss 1460,wscale 2,eol], length 0
20:33:50.161749 IP 10.8.97.141.48608 > 10.8.201.83.https: Flags [F.], seq 7795, ack 12626, win 501, length 0
20:33:50.164172 IP 10.8.97.141.48636 > 10.8.201.83.https: Flags [S], seq 47364728, win 64240, options [mss 1460,sackOK,TS val 2939361013 ecr 0,nop,wscale 7], length 0
20:33:50.165654 IP 10.8.201.83.https > 10.8.97.141.48636: Flags [S.], seq 2423414385, ack 47364729, win 65535, options [mss 1460,wscale 2,eol], length 0
20:33:50.183748 IP 10.8.97.141.48610 > 10.8.201.83.https: Flags [F.], seq 7047, ack 11958, win 501, length 0
20:33:50.185374 IP 10.8.97.141.48644 > 10.8.201.83.https: Flags [S], seq 1049013517, win 64240, options [mss 1460,sackOK,TS val 2939361034 ecr 0,nop,wscale 7], length 0
20:33:50.187660 IP 10.8.201.83.https > 10.8.97.141.48644: Flags [S.], seq 499166165, ack 1049013518, win 65535, options [mss 1460,wscale 2,eol], length 0
20:33:50.221812 IP 10.8.97.141.48622 > 10.8.201.83.https: Flags [F.], seq 6673, ack 11630, win 501, length 0
20:33:50.224168 IP 10.8.97.141.48660 > 10.8.201.83.https: Flags [S], seq 4283733123, win 64240, options [mss 1460,sackOK,TS val 2939361073 ecr 0,nop,wscale 7], length 0
20:33:50.225491 IP 10.8.201.83.https > 10.8.97.141.48660: Flags [S.], seq 4144123547, ack 4283733124, win 65535, options [mss 1460,wscale 2,eol], length 0
20:33:50.237817 IP 10.8.97.141.48636 > 10.8.201.83.https: Flags [F.], seq 4803, ack 9970, win 501, length 0
20:33:50.239792 IP 10.8.97.141.48672 > 10.8.201.83.https: Flags [S], seq 1037329881, win 64240, options [mss 1460,sackOK,TS val 2939361089 ecr 0,nop,wscale 7], length 0
20:33:50.241688 IP 10.8.201.83.https > 10.8.97.141.48672: Flags [S.], seq 51652954, ack 1037329882, win 65535, options [mss 1460,wscale 2,eol], length 0
20:33:50.255801 IP 10.8.97.141.48468 > 10.8.201.83.https: Flags [F.], seq 49683, ack 49802, win 501, length 0
20:33:50.258035 IP 10.8.97.141.48686 > 10.8.201.83.https: Flags [S], seq 3439747964, win 64240, options [mss 1460,sackOK,TS val 2939361107 ecr 0,nop,wscale 7], length 0
20:33:50.259687 IP 10.8.201.83.https > 10.8.97.141.48686: Flags [S.], seq 3045702932, ack 3439747965, win 65535, options [mss 1460,wscale 2,eol], length 0
20:33:50.273877 IP 10.8.97.141.48644 > 10.8.201.83.https: Flags [F.], seq 5925, ack 10966, win 501, length 0
20:33:50.274159 IP 10.8.97.141.48672 > 10.8.201.83.https: Flags [F.], seq 2185, ack 7646, win 501, length 0
20:33:50.275671 IP 10.8.97.141.48702 > 10.8.201.83.https: Flags [S], seq 3495954726, win 64240, options [mss 1460,sackOK,TS val 2939361125 ecr 0,nop,wscale 7], length 0
20:33:50.276338 IP 10.8.97.141.48708 > 10.8.201.83.https: Flags [S], seq 268196819, win 64240, options [mss 1460,sackOK,TS val 2939361125 ecr 0,nop,wscale 7], length 0
20:33:50.277687 IP 10.8.201.83.https > 10.8.97.141.48702: Flags [S.], seq 2705287733, ack 3495954727, win 65535, options [mss 1460,wscale 2,eol], length 0
20:33:50.277687 IP 10.8.201.83.https > 10.8.97.141.48708: Flags [S.], seq 920111436, ack 268196820, win 65535, options [mss 1460,wscale 2,eol], length 0
20:33:50.319756 IP 10.8.97.141.48708 > 10.8.201.83.https: Flags [F.], seq 2559, ack 7978, win 501, length 0
20:33:50.321614 IP 10.8.97.141.48714 > 10.8.201.83.https: Flags [S], seq 3768006918, win 64240, options [mss 1460,sackOK,TS val 2939361171 ecr 0,nop,wscale 7], length 0
20:33:50.325660 IP 10.8.201.83.https > 10.8.97.141.48714: Flags [S.], seq 4064856450, ack 3768006919, win 65535, options [mss 1460,wscale 2,eol], length 0
20:33:50.357839 IP 10.8.97.141.48686 > 10.8.201.83.https: Flags [F.], seq 6673, ack 11630, win 501, length 0
20:33:50.360153 IP 10.8.97.141.48716 > 10.8.201.83.https: Flags [S], seq 2965503105, win 64240, options [mss 1460,sackOK,TS val 2939361209 ecr 0,nop,wscale 7], length 0
20:33:50.361747 IP 10.8.201.83.https > 10.8.97.141.48716: Flags [S.], seq 1002716817, ack 2965503106, win 65535, options [mss 1460,wscale 2,eol], length 0
20:33:50.381846 IP 10.8.97.141.48660 > 10.8.201.83.https: Flags [F.], seq 11909, ack 16278, win 501, length 0
20:33:50.383570 IP 10.8.97.141.48722 > 10.8.201.83.https: Flags [S], seq 3196912143, win 64240, options [mss 1460,sackOK,TS val 2939361232 ecr 0,nop,wscale 7], length 0
20:33:50.387716 IP 10.8.201.83.https > 10.8.97.141.48722: Flags [S.], seq 745661501, ack 3196912144, win 65535, options [mss 1460,wscale 2,eol], length 0
20:33:50.421869 IP 10.8.97.141.48714 > 10.8.201.83.https: Flags [F.], seq 6299, ack 11298, win 501, length 0
20:33:50.422131 IP 10.8.97.141.48702 > 10.8.201.83.https: Flags [F.], seq 10413, ack 14950, win 501, length 0
20:33:50.423815 IP 10.8.97.141.48726 > 10.8.201.83.https: Flags [S], seq 625363203, win 64240, options [mss 1460,sackOK,TS val 2939361273 ecr 0,nop,wscale 7], length 0
20:33:50.424384 IP 10.8.97.141.48736 > 10.8.201.83.https: Flags [S], seq 2998866384, win 64240, options [mss 1460,sackOK,TS val 2939361273 ecr 0,nop,wscale 7], length 0
20:33:50.425670 IP 10.8.201.83.https > 10.8.97.141.48726: Flags [S.], seq 3726922225, ack 625363204, win 65535, options [mss 1460,wscale 2,eol], length 0
20:33:50.429751 IP 10.8.97.141.48736 > 10.8.201.83.https: Flags [S], seq 2998866384, win 64240, options [mss 1460,sackOK,TS val 2939361279 ecr 0,nop,wscale 7], length 0
20:33:50.431679 IP 10.8.201.83.https > 10.8.97.141.48736: Flags [S.], seq 1689958739, ack 2998866385, win 65535, options [mss 1460,wscale 2,eol], length 0
20:33:50.441819 IP 10.8.97.141.48722 > 10.8.201.83.https: Flags [F.], seq 4055, ack 9306, win 501, length 0
20:33:50.444152 IP 10.8.97.141.48744 > 10.8.201.83.https: Flags [S], seq 2880532057, win 64240, options [mss 1460,sackOK,TS val 2939361293 ecr 0,nop,wscale 7], length 0
20:33:50.445670 IP 10.8.201.83.https > 10.8.97.141.48744: Flags [S.], seq 477241384, ack 2880532058, win 65535, options [mss 1460,wscale 2,eol], length 0
20:33:50.473870 IP 10.8.97.141.48716 > 10.8.201.83.https: Flags [F.], seq 8169, ack 12958, win 501, length 0
20:33:50.474142 IP 10.8.97.141.48744 > 10.8.201.83.https: Flags [F.], seq 1437, ack 6982, win 501, length 0
20:33:50.475783 IP 10.8.97.141.48750 > 10.8.201.83.https: Flags [S], seq 4282598074, win 64240, options [mss 1460,sackOK,TS val 2939361325 ecr 0,nop,wscale 7], length 0
20:33:50.476504 IP 10.8.97.141.48758 > 10.8.201.83.https: Flags [S], seq 2681399299, win 64240, options [mss 1460,sackOK,TS val 2939361325 ecr 0,nop,wscale 7], length 0
20:33:50.477685 IP 10.8.201.83.https > 10.8.97.141.48750: Flags [S.], seq 4023882258, ack 4282598075, win 65535, options [mss 1460,wscale 2,eol], length 0
20:33:50.477685 IP 10.8.201.83.https > 10.8.97.141.48758: Flags [S.], seq 891490903, ack 2681399300, win 65535, options [mss 1460,wscale 2,eol], length 0
20:33:50.499827 IP 10.8.97.141.48750 > 10.8.201.83.https: Flags [F.], seq 1063, ack 6650, win 501, length 0
20:33:50.501573 IP 10.8.97.141.48764 > 10.8.201.83.https: Flags [S], seq 3704756315, win 64240, options [mss 1460,sackOK,TS val 2939361350 ecr 0,nop,wscale 7], length 0
20:33:50.503553 IP 10.8.201.83.https > 10.8.97.141.48764: Flags [S.], seq 3377393952, ack 3704756316, win 65535, options [mss 1460,wscale 2,eol], length 0
20:33:50.527870 IP 10.8.97.141.48758 > 10.8.201.83.https: Flags [F.], seq 3307, ack 8638, win 501, length 0
20:33:50.531167 IP 10.8.97.141.48774 > 10.8.201.83.https: Flags [S], seq 1981180304, win 64240, options [mss 1460,sackOK,TS val 2939361380 ecr 0,nop,wscale 7], length 0
20:33:50.533490 IP 10.8.201.83.https > 10.8.97.141.48774: Flags [S.], seq 2913612749, ack 1981180305, win 65535, options [mss 1460,wscale 2,eol], length 0
20:33:50.575869 IP 10.8.97.141.48774 > 10.8.201.83.https: Flags [F.], seq 2559, ack 7978, win 501, length 0
20:33:50.576121 IP 10.8.97.141.48726 > 10.8.201.83.https: Flags [F.], seq 12283, ack 16610, win 501, length 0
20:33:50.577444 IP 10.8.97.141.48790 > 10.8.201.83.https: Flags [S], seq 3179995842, win 64240, options [mss 1460,sackOK,TS val 2939361426 ecr 0,nop,wscale 7], length 0
20:33:50.578024 IP 10.8.97.141.48792 > 10.8.201.83.https: Flags [S], seq 539932949, win 64240, options [mss 1460,sackOK,TS val 2939361427 ecr 0,nop,wscale 7], length 0
20:33:50.579669 IP 10.8.201.83.https > 10.8.97.141.48792: Flags [S.], seq 1549155164, ack 539932950, win 65535, options [mss 1460,wscale 2,eol], length 0
20:33:50.579669 IP 10.8.201.83.https > 10.8.97.141.48790: Flags [S.], seq 1944817386, ack 3179995843, win 65535, options [mss 1460,wscale 2,eol], length 0
20:33:50.601864 IP 10.8.97.141.48764 > 10.8.201.83.https: Flags [F.], seq 7047, ack 11962, win 501, length 0
20:33:50.602147 IP 10.8.97.141.48792 > 10.8.201.83.https: Flags [F.], seq 1437, ack 6982, win 501, length 0
20:33:50.603830 IP 10.8.97.141.48798 > 10.8.201.83.https: Flags [S], seq 536710675, win 64240, options [mss 1460,sackOK,TS val 2939361453 ecr 0,nop,wscale 7], length 0
20:33:50.604085 IP 10.8.97.141.48810 > 10.8.201.83.https: Flags [S], seq 2091560688, win 64240, options [mss 1460,sackOK,TS val 2939361453 ecr 0,nop,wscale 7], length 0
20:33:50.605688 IP 10.8.201.83.https > 10.8.97.141.48798: Flags [S.], seq 1398993659, ack 536710676, win 65535, options [mss 1460,wscale 2,eol], length 0
20:33:50.605688 IP 10.8.201.83.https > 10.8.97.141.48810: Flags [S.], seq 1906623080, ack 2091560689, win 65535, options [mss 1460,wscale 2,eol], length 0
20:33:50.619884 IP 10.8.97.141.48810 > 10.8.201.83.https: Flags [F.], seq 689, ack 6318, win 501, length 0
20:33:50.620150 IP 10.8.97.141.48736 > 10.8.201.83.https: Flags [F.], seq 13779, ack 17938, win 501, length 0
20:33:50.621897 IP 10.8.97.141.48812 > 10.8.201.83.https: Flags [S], seq 1823134635, win 64240, options [mss 1460,sackOK,TS val 2939361471 ecr 0,nop,wscale 7], length 0
20:33:50.622082 IP 10.8.97.141.48822 > 10.8.201.83.https: Flags [S], seq 1172813043, win 64240, options [mss 1460,sackOK,TS val 2939361471 ecr 0,nop,wscale 7], length 0
20:33:50.623697 IP 10.8.201.83.https > 10.8.97.141.48812: Flags [S.], seq 3501157418, ack 1823134636, win 65535, options [mss 1460,wscale 2,eol], length 0
20:33:50.623697 IP 10.8.201.83.https > 10.8.97.141.48822: Flags [S.], seq 3481890285, ack 1172813044, win 65535, options [mss 1460,wscale 2,eol], length 0
20:33:50.649815 IP 10.8.97.141.48790 > 10.8.201.83.https: Flags [F.], seq 5177, ack 10302, win 501, length 0
20:33:50.650080 IP 10.8.97.141.48822 > 10.8.201.83.https: Flags [F.], seq 1437, ack 6982, win 501, length 0
20:33:50.651727 IP 10.8.97.141.48838 > 10.8.201.83.https: Flags [S], seq 4271123730, win 64240, options [mss 1460,sackOK,TS val 2939361501 ecr 0,nop,wscale 7], length 0
20:33:50.652088 IP 10.8.97.141.48846 > 10.8.201.83.https: Flags [S], seq 1905039235, win 64240, options [mss 1460,sackOK,TS val 2939361501 ecr 0,nop,wscale 7], length 0
20:33:50.653676 IP 10.8.201.83.https > 10.8.97.141.48838: Flags [S.], seq 3108965113, ack 4271123731, win 65535, options [mss 1460,wscale 2,eol], length 0
20:33:50.653677 IP 10.8.201.83.https > 10.8.97.141.48846: Flags [S.], seq 3187057643, ack 1905039236, win 65535, options [mss 1460,wscale 2,eol], length 0
20:33:50.671809 IP 10.8.97.141.48798 > 10.8.201.83.https: Flags [F.], seq 4429, ack 9638, win 501, length 0
20:33:50.673792 IP 10.8.97.141.48858 > 10.8.201.83.https: Flags [S], seq 3763361751, win 64240, options [mss 1460,sackOK,TS val 2939361523 ecr 0,nop,wscale 7], length 0
20:33:50.677676 IP 10.8.201.83.https > 10.8.97.141.48858: Flags [S.], seq 1473106855, ack 3763361752, win 65535, options [mss 1460,wscale 2,eol], length 0
20:33:50.709787 IP 10.8.97.141.48812 > 10.8.201.83.https: Flags [F.], seq 5925, ack 10966, win 501, length 0
20:33:50.712115 IP 10.8.97.141.48866 > 10.8.201.83.https: Flags [S], seq 2623458365, win 64240, options [mss 1460,sackOK,TS val 2939361561 ecr 0,nop,wscale 7], length 0
20:33:50.713548 IP 10.8.201.83.https > 10.8.97.141.48866: Flags [S.], seq 1394350830, ack 2623458366, win 65535, options [mss 1460,wscale 2,eol], length 0
20:33:50.735871 IP 10.8.97.141.48866 > 10.8.201.83.https: Flags [F.], seq 1063, ack 6650, win 501, length 0
20:33:50.737704 IP 10.8.97.141.48868 > 10.8.201.83.https: Flags [S], seq 1616764054, win 64240, options [mss 1460,sackOK,TS val 2939361587 ecr 0,nop,wscale 7], length 0
20:33:50.741677 IP 10.8.201.83.https > 10.8.97.141.48868: Flags [S.], seq 3896025663, ack 1616764055, win 65535, options [mss 1460,wscale 2,eol], length 0
20:33:50.765891 IP 10.8.97.141.48858 > 10.8.201.83.https: Flags [F.], seq 5925, ack 10966, win 501, length 0
20:33:50.766159 IP 10.8.97.141.48868 > 10.8.201.83.https: Flags [F.], seq 1437, ack 6982, win 501, length 0
20:33:50.767670 IP 10.8.97.141.48882 > 10.8.201.83.https: Flags [S], seq 1875007993, win 64240, options [mss 1460,sackOK,TS val 2939361617 ecr 0,nop,wscale 7], length 0
20:33:50.768182 IP 10.8.97.141.48898 > 10.8.201.83.https: Flags [S], seq 948327993, win 64240, options [mss 1460,sackOK,TS val 2939361617 ecr 0,nop,wscale 7], length 0
20:33:50.769695 IP 10.8.201.83.https > 10.8.97.141.48882: Flags [S.], seq 173260391, ack 1875007994, win 65535, options [mss 1460,wscale 2,eol], length 0
20:33:50.769695 IP 10.8.201.83.https > 10.8.97.141.48898: Flags [S.], seq 2176406331, ack 948327994, win 65535, options [mss 1460,wscale 2,eol], length 0
20:33:50.789948 IP 10.8.97.141.48846 > 10.8.201.83.https: Flags [F.], seq 10039, ack 14618, win 501, length 0
20:33:50.792198 IP 10.8.97.141.48904 > 10.8.201.83.https: Flags [S], seq 2513718441, win 64240, options [mss 1460,sackOK,TS val 2939361641 ecr 0,nop,wscale 7], length 0
20:33:50.795716 IP 10.8.201.83.https > 10.8.97.141.48904: Flags [S.], seq 2539666745, ack 2513718442, win 65535, options [mss 1460,wscale 2,eol], length 0
20:33:50.813824 IP 10.8.97.141.48898 > 10.8.201.83.https: Flags [F.], seq 3307, ack 8642, win 501, length 0
20:33:50.814086 IP 10.8.97.141.48838 > 10.8.201.83.https: Flags [F.], seq 13405, ack 17606, win 501, length 0
20:33:50.815439 IP 10.8.97.141.48920 > 10.8.201.83.https: Flags [S], seq 130276442, win 64240, options [mss 1460,sackOK,TS val 2939361664 ecr 0,nop,wscale 7], length 0
20:33:50.817161 IP 10.8.97.141.48926 > 10.8.201.83.https: Flags [S], seq 2001286230, win 64240, options [mss 1460,sackOK,TS val 2939361666 ecr 0,nop,wscale 7], length 0
20:33:50.817540 IP 10.8.201.83.https > 10.8.97.141.48920: Flags [S.], seq 3475849051, ack 130276443, win 65535, options [mss 1460,wscale 2,eol], length 0
20:33:50.817540 IP 10.8.201.83.https > 10.8.97.141.48926: Flags [S.], seq 1004556508, ack 2001286231, win 65535, options [mss 1460,wscale 2,eol], length 0
20:33:50.835891 IP 10.8.97.141.48904 > 10.8.201.83.https: Flags [F.], seq 2559, ack 7978, win 501, length 0
20:33:50.837375 IP 10.8.97.141.48928 > 10.8.201.83.https: Flags [S], seq 4270587751, win 64240, options [mss 1460,sackOK,TS val 2939361686 ecr 0,nop,wscale 7], length 0
20:33:50.841708 IP 10.8.201.83.https > 10.8.97.141.48928: Flags [S.], seq 3804040149, ack 4270587752, win 65535, options [mss 1460,wscale 2,eol], length 0
20:33:50.863911 IP 10.8.97.141.48920 > 10.8.201.83.https: Flags [F.], seq 2933, ack 8310, win 501, length 0
20:33:50.866258 IP 10.8.97.141.48936 > 10.8.201.83.https: Flags [S], seq 4218610794, win 64240, options [mss 1460,sackOK,TS val 2939361715 ecr 0,nop,wscale 7], length 0
20:33:50.869706 IP 10.8.201.83.https > 10.8.97.141.48936: Flags [S.], seq 3864870717, ack 4218610795, win 65535, options [mss 1460,wscale 2,eol], length 0
20:33:50.931876 IP 10.8.97.141.48928 > 10.8.201.83.https: Flags [F.], seq 6299, ack 11298, win 501, length 0
20:33:50.932131 IP 10.8.97.141.48926 > 10.8.201.83.https: Flags [F.], seq 8543, ack 13290, win 501, length 0
20:33:50.933471 IP 10.8.97.141.48940 > 10.8.201.83.https: Flags [S], seq 3677425671, win 64240, options [mss 1460,sackOK,TS val 2939361782 ecr 0,nop,wscale 7], length 0
20:33:50.934041 IP 10.8.97.141.48946 > 10.8.201.83.https: Flags [S], seq 3542177037, win 64240, options [mss 1460,sackOK,TS val 2939361783 ecr 0,nop,wscale 7], length 0
20:33:50.935669 IP 10.8.201.83.https > 10.8.97.141.48940: Flags [S.], seq 4059632719, ack 3677425672, win 65535, options [mss 1460,wscale 2,eol], length 0
20:33:50.935669 IP 10.8.201.83.https > 10.8.97.141.48946: Flags [S.], seq 11974607, ack 3542177038, win 65535, options [mss 1460,wscale 2,eol], length 0
20:33:50.959868 IP 10.8.97.141.48882 > 10.8.201.83.https: Flags [F.], seq 14153, ack 18270, win 501, length 0
20:33:50.961499 IP 10.8.97.141.48958 > 10.8.201.83.https: Flags [S], seq 603838632, win 64240, options [mss 1460,sackOK,TS val 2939361810 ecr 0,nop,wscale 7], length 0
20:33:50.965683 IP 10.8.201.83.https > 10.8.97.141.48958: Flags [S.], seq 43001226, ack 603838633, win 65535, options [mss 1460,wscale 2,eol], length 0
20:33:50.981896 IP 10.8.97.141.48940 > 10.8.201.83.https: Flags [F.], seq 3307, ack 8642, win 501, length 0
20:33:50.984088 IP 10.8.97.141.48966 > 10.8.201.83.https: Flags [S], seq 3339458174, win 64240, options [mss 1460,sackOK,TS val 2939361833 ecr 0,nop,wscale 7], length 0
20:33:50.987497 IP 10.8.201.83.https > 10.8.97.141.48966: Flags [S.], seq 3216806070, ack 3339458175, win 65535, options [mss 1460,wscale 2,eol], length 0
20:33:50.999799 IP 10.8.97.141.48958 > 10.8.201.83.https: Flags [F.], seq 2559, ack 7974, win 501, length 0
20:33:51.001335 IP 10.8.97.141.48970 > 10.8.201.83.https: Flags [S], seq 1657709866, win 64240, options [mss 1460,sackOK,TS val 2939361850 ecr 0,nop,wscale 7], length 0
20:33:51.003670 IP 10.8.201.83.https > 10.8.97.141.48970: Flags [S.], seq 3795845768, ack 1657709867, win 65535, options [mss 1460,wscale 2,eol], length 0
20:33:51.025878 IP 10.8.97.141.48946 > 10.8.201.83.https: Flags [F.], seq 6299, ack 11298, win 501, length 0
20:33:51.029172 IP 10.8.97.141.48980 > 10.8.201.83.https: Flags [S], seq 3102633034, win 64240, options [mss 1460,sackOK,TS val 2939361878 ecr 0,nop,wscale 7], length 0
20:33:51.031507 IP 10.8.201.83.https > 10.8.97.141.48980: Flags [S.], seq 1412547607, ack 3102633035, win 65535, options [mss 1460,wscale 2,eol], length 0
20:33:51.047885 IP 10.8.97.141.48980 > 10.8.201.83.https: Flags [F.], seq 689, ack 6318, win 501, length 0
20:33:51.049552 IP 10.8.97.141.48992 > 10.8.201.83.https: Flags [S], seq 394857710, win 64240, options [mss 1460,sackOK,TS val 2939361898 ecr 0,nop,wscale 7], length 0
20:33:51.053709 IP 10.8.201.83.https > 10.8.97.141.48992: Flags [S.], seq 1332197790, ack 394857711, win 65535, options [mss 1460,wscale 2,eol], length 0
20:33:51.071879 IP 10.8.97.141.48970 > 10.8.201.83.https: Flags [F.], seq 4803, ack 9970, win 501, length 0
```

Possible cause:
https://github.com/Nitrokey/nethsm-pkcs11/blob/ed449b6e6b348198e8b2cf36758e215545432833/pkcs11/src/config/initialization.rs#L120

```
        let agent = ureq::AgentBuilder::new()
            .tls_config(Arc::new(tls_conf))
            .max_idle_connections(2)
            .max_idle_connections_per_host(2)
            .build();
```

Sample Code:
Hint: python-pkcs11 releases the GIL from version 7.0.0
```
(venv) [root@witc-nuc pkcs11]# pip3 freeze | grep pkcs11
python-pkcs11==0.7.0
```

```
import pkcs11
import secrets
import time
import threading

lib = pkcs11.lib('./nethsm-pkcs11-v1.0.0-x86_64-fedora.38.so')

token = lib.get_token(token_label='LocalHSM')

def runTest(n, key):
    for i in range(0, 10):
        print(f"thread {n}, run {i}")
        for j in range(0, 1000):
            text=secrets.token_bytes(16)
            signature=key.sign(text)

threads = list()

for n in range(0, 4):
    session=token.open()
    thread = threading.Thread(target=runTest, args=(n, session.get_key(object_class=pkcs11.ObjectClass.PRIVATE_KEY, label='witcLoadTest')))
    threads.append(thread)

    thread.start()


for thread in threads:
    thread.join()
```

Sample output, taking 6m 58s for 40'000 signatures (about 95 signatures/sec)

```
thread 0, run 0
thread 1, run 0
thread 2, run 0
thread 3, run 0
thread 0, run 1
thread 1, run 1
thread 3, run 1
thread 2, run 1
thread 1, run 2
thread 0, run 2
thread 2, run 2
thread 3, run 2
thread 1, run 3
thread 0, run 3
thread 2, run 3
thread 3, run 3
thread 0, run 4
thread 1, run 4
thread 2, run 4
thread 3, run 4
thread 0, run 5
thread 2, run 5
thread 1, run 5
thread 3, run 5
thread 0, run 6
thread 2, run 6
thread 1, run 6
thread 3, run 6
thread 0, run 7
thread 2, run 7
thread 1, run 7
thread 3, run 7
thread 0, run 8
thread 2, run 8
thread 1, run 8
thread 3, run 8
thread 0, run 9
thread 2, run 9
thread 1, run 9
thread 3, run 9
```

**Comment by daringer** [comment]
```
 .max_idle_connections(2)
 .max_idle_connections_per_host(2)
```

this limits the max idle connections, but this is actually not needed. The default is 100, I would suggest to drop the the generic restriction and increase the `per_host` to 100.

**Comment by aio-witc** [comment]
- Possible including a timeout (e.g. sessions not used for 5s will be closed).
- TLS1.3/0-RTT could be used to reopen a session quickly ;-)
- value should be configurable in the config file, as there might be no "one-fits-it-all"-value

**Comment by daringer** [comment]
I would suggest to first test if the initial issue might be resolved with the increase of the open connections, then a configuration might make sense, the other ideas might be out of scope for this particular issue.
